Référence	ContexteGauche	Pivot	ContexteDroit
TXM_etude_des_moeurs	de sept heures du soir jusqu’à cinq	heures du matin	, mais encore il avait habitué sa femme et Jean à respecter
TXM_etude_des_moeurs	de son mari était menacée. Vers cinq	heures du matin	, les premiers levés dans la campagne avaient vu passer la gendarmerie
TXM_etude_des_moeurs	de la première métairie. Il était dix	heures du matin	, le mois d’août était chaud, le ciel était sans
TXM_etude_des_moeurs	à demain. Le lendemain, à cinq	heures du matin	, au petit jour, Bonnébault et sa mère frappaient à la
TXM_etude_des_moeurs	de commencer son rôle d’ange dès onze	heures du matin	. Madame de Maufrigneuse était à demi pensive : mêmes inquiétudes la
TXM_etude_des_moeurs	Paris, le notaire se trouvait à neuf	heures du matin	chez les Keller, il y apprit que le fatal mandat était
TXM_etude_des_moeurs	, dans une fatale nuit, à trois	heures du matin	, jouant chez la duchesse de Luynes, interrompit le jeu,
TXM_etude_des_moeurs	alla sur-le-champ chez sa pénitente. A onze	heures du matin	, du Croisier reçut un mandat de comparution qui le mandait,
TXM_etude_des_moeurs	de bonheur, et resta. Vers trois	heures du matin	, les cent cinquante mille francs étaient rentrés dans la caisse des
TXM_etude_des_moeurs	. Obligée d'être au bureau dès dix	heures du matin	, la pauvre Agathe eut à peine le temps de dîner.
TXM_etude_des_moeurs	qui avait déjeuné à Vierzon, à six	heures du matin	, d'une exécrable tasse de café. Quand Joseph eut avalé
TXM_etude_des_moeurs	aller à Bourges et en revenir de cinq	heures du matin	à cinq heures du soir, avec son cheval, et Flore
TXM_etude_des_moeurs	mémorable expédition ne fut terminée qu'à trois	heures du matin	, heure à laquelle ces mauvais drôles allèrent souper chez la Cognette
TXM_etude_des_moeurs	reconnu Fario ; mais quand, à cinq	heures du matin	, il eut bien repris ses sens, qu'il se vit
TXM_etude_des_moeurs	la place Saint-Jean, à deux ou trois	heures du matin	, gris comme des bouchons de vin de Champagne, et en
TXM_etude_des_moeurs	de l'église des Capucins, à huit	heures du matin	. Goddet, qui faisait partie du banquet en sa qualité d'
TXM_etude_des_moeurs	en le mettant au tombeau. Dès neuf	heures du matin	, monsieur Martener alla chez le Président, auquel il raconta la
TXM_etude_des_moeurs	de Nègrepelisse, viendra vous chercher à quatre	heures du matin	. Faisons chacun nos dispositions, car l'affaire ne peut s'
TXM_etude_des_moeurs	. Monsieur de Nègrepelisse était venu dès trois	heures du matin	pour assister monsieur de Bargeton ; il a dit à monsieur de
TXM_etude_des_moeurs	, il resta chez elle jusqu'à deux	heures du matin	pour pouvoir lui parler en particulier. Lucien avait appris dans les
TXM_etude_des_moeurs	la protection de l'Administration. A cinq	heures du matin	Rastignac vint chercher Lucien. —Mon cher, vous êtes logé dans
TXM_etude_des_moeurs	de la mort. Il était alors cinq	heures du matin	. Un oiseau vint s'abattre sur les pots de fleurs qui
TXM_etude_des_moeurs	recevoir. —Mademoiselle s'est couchée à trois	heures du matin	, et personne n'oserait entrer chez elle avant qu'elle n'
TXM_etude_des_moeurs	pauvre inventeur. Le lendemain, à sept	heures du matin	, Boniface Cointet se promenait le long de la prise d'eau
TXM_etude_des_moeurs	Il y a deux jours, à cinq	heures du matin	, j'ai reçu le dernier soupir d'une des plus belles
TXM_etude_des_moeurs	brillait, l'eau bouillait. Vers deux	heures du matin	, Kolb, moins occupé que David, entendit un soupir tourné
TXM_etude_des_moeurs	on peut jouer l'amour. A six	heures du matin	, Cérizet vint voir Petit-Claud. —Demain, à midi, Doublon
TXM_etude_des_moeurs	cher, dit Lucien à Petit-Claud à deux	heures du matin	en revenant à pied : je suis venu, j'ai vu
TXM_etude_des_moeurs	elle se trouvait que, sur les sept	heures du matin	, Petit-Claud se présenta pour lui parler d'affaires. Dans ces
TXM_etude_des_moeurs	plus longtemps. Le lendemain, à cinq	heures du matin	, les hôtes du château d'Anzy furent sur pied. Le
TXM_etude_des_moeurs	, et se promirent de venir à cinq	heures du matin	vérifier l'état des scellés. Jugez de leur étonnement et du
TXM_etude_des_moeurs	, ou plutôt le lendemain, à huit	heures du matin	, Dinah déguisée arrivait du bal pour se coucher. Elle était
TXM_etude_des_moeurs	était fort innocemment occupée, sur les huit	heures du matin	, à écouter pendant son déjeuner les divers rapports de son garde
TXM_etude_des_moeurs	on ne le retrouverait jamais. Vers six	heures du matin	, le pêcheur ramena ce jeune corps. Les deux ou trois
TXM_etude_des_moeurs	de commencer son rôle d'ange dès onze	heures du matin	. Madame de Maufrigneuse était à demi pensive : mêmes inquiétudes la
TXM_etude_des_moeurs	Paris, le notaire se trouvait à neuf	heures du matin	chez les Keller, il y apprit que le fatal mandat était
TXM_etude_des_moeurs	, dans une fatale nuit, à trois	heures du matin	, jouant chez la duchesse de Luynes, interrompit le jeu,
TXM_etude_des_moeurs	alla sur-le-champ chez sa pénitente. A onze	heures du matin	, du Croisier reçut un mandat de comparution qui le mandait,
TXM_etude_des_moeurs	fils unique arrive ordinairement à Nemours vers cinq	heures du matin	, et neuf heures sonnaient ! Qui pouvait causer un pareil retard
TXM_etude_des_moeurs	son cocher. Arrivé chez lui vers cinq	heures du matin	, il se coucha dans les ruines de toutes ses idées antérieures
TXM_etude_des_moeurs	sans que nous le sussions. A sept	heures du matin	, après avoir dit mes prières, en ouvrant la fenêtre pour
TXM_etude_des_moeurs	. En entrant à Nemours, à cinq	heures du matin	, Ursule s'éveilla toute honteuse de son désordre, et de
TXM_etude_des_moeurs	dit madame Crémière. Quand, vers deux	heures du matin	, il ne resta plus dans le salon que Savinien, Bongrand
TXM_etude_des_moeurs	aiguille de la pendule allait bientôt marquer deux	heures du matin	. Elle se retourna et contempla le marquis endormi, la tête
TXM_etude_des_moeurs	ses connaissances, il se leva dès cinq	heures du matin	, lut les répertoires de jurisprudence et les livres qui traitaient des
TXM_etude_des_moeurs	rien casser ni rien renverser. A deux	heures du matin	, le déménagement était opéré. César et sa femme couchèrent au
TXM_etude_des_moeurs	une fusée brillante, s’éteignit à cinq	heures du matin	. Vers cette heure, des cent et quelques fiacres qui remplissaient
TXM_etude_des_moeurs	examine à fond les affaires, à cinq	heures du matin	. Nous serons heureux et fiers d’avoir obtenu votre confiance,
TXM_etude_des_moeurs	que monsieur de Nucingen, rentré à cinq	heures du matin	d’un bal donné par les Keller, ne pouvait pas être
TXM_etude_des_moeurs	, dans un profond silence. A deux	heures du matin	, Popinot ouvrit doucement la porte du salon et fit signe à
TXM_etude_des_moeurs	jour les affaires de César. A huit	heures du matin	, ces deux héroïques amis, l’un vieux soldat, l’
TXM_etude_des_moeurs	je viendrai passer ici les matinées de huit	heures du matin	à six heures du soir. Pour vous refaire une fortune,
TXM_etude_des_moeurs	par un clair de lune, à deux	heures du matin	: le jour, c'est un abrégé de Paris ; pendant
TXM_etude_des_moeurs	entendu tes murmures, entre minuit et deux	heures du matin	, ne connaît encore rien de ta vraie poésie, ni de
TXM_etude_des_moeurs	il pouvait venir le lendemain, à huit	heures du matin	, rue Sainte-Foi, dans une maison dont il lui donna le
TXM_etude_des_moeurs	reviennent du bal, entre minuit et deux	heures du matin	, combien de scènes bizarres ne se passe-t -il pas, en
TXM_etude_des_moeurs	me dit pas. Il était environ trois	heures du matin	lorsque madame Jules fut réveillée par un pressentiment qui l'avait frappée
TXM_etude_des_moeurs	incartade. Viens -y demain, à neuf	heures du matin	. Je suis dans une chambre à laquelle on ne parvient que
TXM_etude_des_moeurs	. Monsieur de Montriveau resta jusqu'à deux	heures du matin	près de sa maîtresse, qui, dès ce moment, ne
TXM_etude_des_moeurs	ne sait peut-être pas qu'il est deux	heures du matin	, j'ai cru que madame était indisposée. --Oui, je
TXM_etude_des_moeurs	la porte du marquis de Montriveau depuis huit	heures du matin	jusqu'à trois heures après midi. Armand demeurait rue de Seine
TXM_etude_des_moeurs	Montriveau avaient détruit leur ouvrage. A neuf	heures du matin	, nulle trace n'existait ni de l'escalier ni des ponts
TXM_etude_des_moeurs	. Donc, si demain, de huit	heures du matin	à dix heures du soir, vous n'avez pas jeté de
TXM_etude_des_moeurs	une corde, deux flacons, à dix	heures du matin	, le lendemain. Soyez à vous promener vers ce moment -là
TXM_etude_des_moeurs	, facteur, le lendemain, vers huit	heures du matin	, au concierge de l'hôtel San-Réal. Pour se rapprocher du
TXM_etude_des_moeurs	Il sortit du Rocher de Cancale à deux	heures du matin	, dormit comme un enfant, se réveilla le lendemain frais et
TXM_etude_des_moeurs	de rien, il sera coffré dès quatre	heures du matin	, dit le juge en consultant son Almanach pour vérifier le lever
TXM_etude_des_moeurs	baiser à la jeune fille. À sept	heures du matin	, le baron, au comble du bonheur, car il avait
TXM_etude_des_moeurs	la baronne. Le lendemain, à neuf	heures du matin	, le baron, en attendant sa fille à laquelle il avait
TXM_etude_des_moeurs	, qu’il reviendrait à quatre ou cinq	heures du matin	, et il alla rue du Dauphin. On était alors à
TXM_etude_des_moeurs	laquelle le Conseiller-d’État fut en proie à cinq	heures du matin	, dans le lit élégant et coquet de Crevel, surpassa de
TXM_etude_des_moeurs	et sortit. Le lendemain, à dix	heures du matin	, le comte de Forzheim se fit annoncer chez le prince de
TXM_etude_des_moeurs	ça ! … Il est ivre dès six	heures du matin	, il fait un matelas tous les mois, il est toute
TXM_etude_des_moeurs	nous mariera, par exception, à neuf	heures du matin	. La messe est à dix heures, nous serons ici à
TXM_etude_des_moeurs	dit à du Tillet, sur les sept	heures du matin	: — Si tu étais gentil, tu me donnerais à dîner
TXM_etude_des_moeurs	sans l’avoir corrigé. » Vers deux	heures du matin	, le valet-de-chambre vint dire à une petite bergère des Alpes,
TXM_etude_des_moeurs	Rastignac resta, lui, jusqu’à deux	heures du matin	, et l’on dit qu’il est égoïste ! Beaudenord partit
TXM_etude_des_moeurs	du thé pour rester éveillé jusqu’à deux	heures du matin	, afin de pouvoir vous dire solennellement : Mariez -vous. Ne
TXM_etude_des_moeurs	chevaux de fiacre. Levés vers les sept	heures du matin	en été comme en hiver, après leur déjeuner ils allaient donner
TXM_etude_des_moeurs	se présentait chez ces grandes dames à dix	heures du matin	.) Enfin, les quartiers de ses rentes étaient payés chez
TXM_etude_des_moeurs	associé. Schmucke et Pons, à deux	heures du matin	, rentrèrent chez eux par les boulevards, en philosophant à perte
TXM_etude_des_moeurs	. Quelques jours après, sur les sept	heures du matin	, en voyant Rémonencq occupé d’ouvrir sa boutique, elle alla
TXM_etude_des_moeurs	des exceptions grandioses. Le lendemain à six	heures du matin	, madame Cibot examinait, rue de la Perle, la maison
TXM_etude_des_moeurs	partit en cabriolet de remise sur les dix	heures du matin	pour la rue de Hanovre, où il espérait pouvoir obtenir une
TXM_etude_des_moeurs	aux yeux. Le lendemain, à six	heures du matin	, Élie Magus et Rémonencq décrochèrent chacun leurs tableaux. Deux quittances
TXM_etude_des_moeurs	les prieras d’être ici demain à neuf	heures du matin	, de venir demander de mes nouvelles, en ayant l’air
TXM_etude_des_moeurs	aller lire le testament entre deux et trois	heures du matin	. La visite de mademoiselle Héloïse Brisetout, à dix heures et
TXM_etude_des_moeurs	j’irai relever monsieur Schmucke sur les quatre	heures du matin	, et, si vous voulez venir, vous aurez le testament
TXM_etude_des_moeurs	pendant la nuit … Il était environ trois	heures du matin	. À trois heures et demie, selon les prévisions de Pons
TXM_etude_des_moeurs	le prêtre s’en alla. À sept	heures du matin	, le docteur Poulain vint voir Schmucke affectueusement et voulut l’obliger
TXM_etude_des_moeurs	une hache ; et, sur les deux	heures du matin	, tous sortent par des issues différentes. Les moments acquéraient du
TXM_etude_des_moeurs	nuit, ils s’en vont à huit	heures du matin	. Ils se disent auteurs ; mais je ne sais pas où
TXM_etude_des_moeurs	le vieillard courut chez lui. À huit	heures du matin	, le lendemain, Godefroid frappait à la porte du célèbre médecin
TXM_etude_des_moeurs	n’était rentré chez lui qu’à deux	heures du matin	. Le vieillard, venu à une heure et demie à la
TXM_etude_des_moeurs	, et attendit le jour. À neuf	heures du matin	, il se présenta chez le médecin, et lui demanda pourquoi
TXM_etude_des_moeurs	belle voûte que celle qui brillait à deux	heures du matin	, je vous assure qu’il faisait froid dans le palais où
TXM_etude_des_moeurs	lesté de sa tasse de café dès huit	heures du matin	, il sortait avec une exactitude d’horloge, et passait par
TXM_etude_des_moeurs	ou quinze salons de huit heures à trois	heures du matin	. A l’Opéra, il causait avec les journalistes, car
TXM_etude_des_moeurs	Paris à sept heures et demie ou huit	heures du matin	, en hiver, que vous voyez, par un froid piquant
TXM_etude_des_moeurs	du Martroi. De six heures à huit	heures du matin	, il tenait les livres d’une forte maison de nouveautés de
TXM_etude_des_moeurs	lesté de sa tasse de café dès huit	heures du matin	, il sortait avec une exactitude d’horloge, et passait par
TXM_etude_des_moeurs	ou quinze salons de huit heures à trois	heures du matin	. À l’Opéra, il causait avec les journalistes, car
TXM_etude_des_moeurs	Paris à sept heures et demie ou huit	heures du matin	, en hiver, que vous voyez, par un froid piquant
TXM_etude_des_moeurs	du Martroi. De six heures à huit	heures du matin	, il tenait les livres d’une forte maison de nouveautés de
TXM_etude_des_moeurs	, Colleville tenait de sept heures à neuf	heures du matin	, les livres d’un négociant. A dix heures, il
TXM_etude_des_moeurs	leurs rebuts et qu’ils vident à six	heures du matin	à leurs portes quand les regrattiers n’en veulent plus … cet
TXM_etude_des_moeurs	commençait ses opérations le mardi, vers trois	heures du matin	en été, vers cinq heures en hiver ; l’heure de
TXM_etude_des_moeurs	; je vais à la messe à six	heures du matin	, quand on ne me voit pas ; je fais maigre le
TXM_etude_des_moeurs	y prendre avec elle ? Jusqu’à deux	heures du matin	, ils passèrent le temps à se dire les bêtises que les
TXM_etude_des_moeurs	voix. « Vous partirez demain à cinq	heures du matin	, on vous conduira chez un Garde au fond de la forêt
TXM_etude_des_moeurs	écria Lucien. Le lendemain, à sept	heures du matin	, en s’éveillant dans cette charmante chambre rose et blanche,
TXM_etude_des_moeurs	la rue, il entendit, à deux	heures du matin	, la voiture de sa maîtresse dès le boulevard. Son cœur
TXM_etude_des_moeurs	par lui, dura de minuit à deux	heures du matin	. --_Ichénie_, dit enfin le baron en appelant Europe, _optenez
TXM_etude_des_moeurs	, dans la nuit même, à deux	heures du matin	, Asie arriva quai Malaquais en fiacre, et trouva le chauffeur
TXM_etude_des_moeurs	en riant, qu’on atteignit à quatre	heures du matin	. Bixiou crut avoir remporté l’une de ces victoires si plaisamment
TXM_etude_des_moeurs	, madame du Val-Noble était, à neuf	heures du matin	, assise au chevet du lit d’Esther et y pleurait,
TXM_etude_des_moeurs	auberge du côté de Nemours. Vers six	heures du matin	, le lendemain, il s’en alla seul, à pied
TXM_etude_des_moeurs	-il, d’illicite, faite à sept	heures du matin	. — « Allez dire à votre maître, répondit -il avec
TXM_etude_des_moeurs	certaine heure, fût -ce minuit ou six	heures du matin	, dix heures ou cinq heures, les moments les plus incommodes
TXM_etude_des_moeurs	mois d’avril 1839, sur les dix	heures du matin	, le salon de madame Marion, veuve d’un ancien receveur
TXM_etude_des_moeurs	Achille Pigoult ; mais il est bientôt deux	heures du matin	et le sommeil me gagne : à demain donc, si j’
TXM_etude_des_moeurs	clapoter ses flots. 4 mai, cinq	heures du matin	. J’avais compté sur un sommeil embelli par les plus beaux
TXM_etude_des_moeurs	mot que vous fîtes porter, à trois	heures du matin	, chez un monsieur de Saint-Estève, la police se mit si
TXM_etude_des_moeurs	une de leurs ruses habituelles. A six	heures du matin	, au petit jour, les deux agents revinrent. Après avoir
TXM_etude_des_moeurs	côté dangereux. Marthe arriva sur les trois	heures du matin	à la mare, où elle laissa Couraut en sentinelle. Après
TXM_etude_des_moeurs	procès criminel. XX HORRIBLE PERIPETIE A cinq	heures du matin	, le lendemain de la plaidoirie de M. de Grandville,
TXM_etude_des_moeurs	, dit le premier ministre, vers trois	heures du matin	, au moment où le jour faisait pâlir les bougies, deux
TXM_etude_des_moeurs	rentrèrent au salon. Il était alors quatre	heures du matin	. Fouché partit le premier. Voici ce que fit, avec
TXM_etude_des_moeurs	un des personnages qui écoutaient, à trois	heures du matin	, tire sa montre, interrompt le jeu et demande tout à
TXM_etude_des_moeurs	promis de se lever entre deux et trois	heures du matin	pour voir les fenêtres du cabinet d'Albert. Quand cette heure
TXM_etude_des_moeurs	me consulter que de six heures à huit	heures du matin	, je me couche après mon dîner, et je travaille pendant
TXM_etude_des_moeurs	vous voulez, ses prétentions. Vers deux	heures du matin	, au moment où le souper finissait, il ne se trouva
TXM_etude_des_moeurs	la duchesse, s'étant réveillée vers quatre	heures du matin	, me fit, de la manière la plus touchante et en
TXM_etude_des_moeurs	où, en venant aux Touches à sept	heures du matin	, il aperçut entre deux ajoncs, à une fenêtre, Béatrix
TXM_etude_des_moeurs	Monsieur dîne ici. Calyste rentra vers deux	heures du matin	à son hôtel. Après avoir attendu jusqu'à minuit et demi
TXM_etude_des_moeurs	La conversation ainsi commencée alla jusqu'à deux	heures du matin	sans que Calyste, dont la rage fut sans cesse refoulée par
TXM_etude_des_moeurs	de venir pendant la soirée. A deux	heures du matin	, madame de Listomère, qui n'était restée que pour accabler
TXM_etude_des_moeurs	le comte et moi, jusqu'à deux	heures du matin	à nous promener le long des fossés de la Bastille, comme
TXM_etude_des_moeurs	il serait entré chez ses voisines dès six	heures du matin	, en arrivant à son atelier. Il eut cependant encore assez
TXM_etude_des_moeurs	les équipages s'en aller sur les deux	heures du matin	, la comtesse n'a eu qu'une fantaisie ou une curiosité
TXM_etude_des_moeurs	heures du soir à deux et souvent trois	heures du matin	. Elle mange peu pour attirer le regard sur une taille fine
TXM_etude_des_moeurs	mardi-gras de l'année 1838, à quatre	heures du matin	, la comtesse, enveloppée d'un domino noir et assise sur
TXM_etude_des_moeurs	bal masqué de l'Opéra. Vers trois	heures du matin	, entraînée par l'ivresse du bal, Clémentine, pour qui
TXM_etude_des_moeurs	gardait le sort. Vers deux ou trois	heures du matin	, Julie était sur son séant, sombre et rêveuse, dans
TXM_etude_des_moeurs	râlements du chien semblaient venir. A sept	heures du matin	, les recherches de la gendarmerie, du général, de ses
TXM_etude_des_moeurs	où nous sommes. --Mais il est deux	heures du matin	, et l'histoire de Rosine nous a préparées, dit la
TXM_etude_des_moeurs	attribués à la démence. Sur les huit	heures du matin	, le lendemain, madame Guillaume surprit sa fille pâle, les
TXM_etude_des_moeurs	son maître entrant dans l’église vers neuf	heures du matin	. Desplein, qui ne faisait jamais alors un pas sans son
TXM_etude_des_moeurs	des Porta. Nous sommes arrivés à cinq	heures du matin	, à sept ils étaient tous devant Dieu. Giacomo prétend qu'
TXM_etude_des_moeurs	que le pauvre garçon se levait à cinq	heures du matin	, et allait expédier ses affaires afin de pouvoir se trouver à
TXM_etude_des_moeurs	autre pour eux -mêmes. Vers les deux	heures du matin	, l'on servit un ambigu dans une immense galerie où,
TXM_etude_des_moeurs	à ses clients qu’entre deux et trois	heures du matin	: nous verrons s’il viendra, le vieux malfaiteur ! Et
TXM_etude_des_moeurs	. Il pouvait être de huit à neuf	heures du matin	. L’Étude avait pour tout ornement ces grandes affiches jaunes qui
TXM_etude_des_moeurs	son lustre au moment où, vers sept	heures du matin	, le chat de madame Vauquer précède sa maîtresse ; saute sur
TXM_etude_des_moeurs	qui a dû rentrer du bal à deux	heures du matin	, n’est -ce pas singulier ! Il n’y a que
TXM_etude_des_moeurs	Un soir j’ai attendu jusqu’à trois	heures du matin	pour voir Nasie, que je n’avais pas vue depuis deux
TXM_etude_des_moeurs	monde. Il rentrait à trois ou quatre	heures du matin	, se levait à midi pour faire sa toilette, allait se
TXM_etude_des_moeurs	ni Paris ni le monde. À cinq	heures du matin	, je vais partir pour aller m’ensevelir au fond de la
TXM_etude_des_moeurs	la mort de son père. Vers quatre	heures du matin	, la foule des salons commençait à s’éclaircir. Bientôt la
TXM_etude_des_moeurs	--A demain, me dit -elle vers deux	heures du matin	, quand elle sortit du bal. --Je n’irai pas,
TXM_etude_des_moeurs	souvent à boire que, vers les trois	heures du matin	, sans être complétement ivre, Sarrasine se trouva sans force contre
TXM_etude_des_moeurs	le célèbre docteur se dirigea, dès sept	heures du matin	, vers la rue du Fouarre où demeurait monsieur Jean-Jules Popinot,
TXM_etude_des_moeurs	travaillait au Palais. De quatre à sept	heures du matin	en été, de six à neuf heures en hiver, cette
TXM_etude_des_moeurs	chez lui. Le lendemain, vers dix	heures du matin	, Popinot, qui la veille avait rédigé son rapport, s’
TXM_etude_des_moeurs	soirs de neuf heures à deux ou trois	heures du matin	, pour vous faire faire tant de frais et supporter tant de
TXM_etude_des_moeurs	; car depuis quatre heures jusqu'à deux	heures du matin	, j'appartiens à Paris. Macumer est un admirable maître de
TXM_etude_des_moeurs	la nuit. Je viens, à sept	heures du matin	, de la lever moi -même ; elle a retrouvé quelque force
TXM_etude_des_moeurs	et demie, et se levait à cinq	heures du matin	. Enfin, sûr de la discrétion de Latournelle et de Butscha
TXM_etude_des_moeurs	diligences Touchard. Il était plus de huit	heures du matin	. Sous l'énorme porche, au-dessus duquel se lit sur un
TXM_etude_des_moeurs	l'écurie de tenir prête, à sept	heures du matin	, la voiture à la Daumont, pour aller à Presles ;
TXM_etude_des_moeurs	continuel. Le comte se levait dès quatre	heures du matin	en toute saison, travaillait jusqu'à midi, vaquait à ses
TXM_etude_des_moeurs	à celle d'un moine. A cinq	heures du matin	, en tout temps, Godeschal s'éveillait. Il descendait avec
TXM_etude_des_moeurs	déjeuner qui n'a fini qu'à sept	heures du matin	. » C'était miraculeusement écrit. Un expert eût juré que
TXM_etude_des_moeurs	de la veine. Aussi, vers trois	heures du matin	, après des retours de fortune et des gains inespérés, en
TXM_etude_des_moeurs	dormait du plus profond sommeil. Vers onze	heures du matin	, une voix terrible éveilla le clerc qui, reconnaissant son oncle
TXM_etude_des_moeurs	à sa boutonnière, stationnait, à huit	heures du matin	, au mois de mai, sous la porte cochère de l'
TXM_etude_des_moeurs	d'environ vingt-six ans, descendait vers trois	heures du matin	le grand escalier de l'hôtel où demeurait l'Archi-Chancelier de l'
TXM_etude_des_moeurs	sous quelque despotisme inconnu. Arrivé dès sept	heures du matin	au bureau des Messageries de la rue Notre-Dame-des-Victoires, le jeune avocat
TXM_etude_des_moeurs	retracés dans cette histoire. Sur les huit	heures du matin	, une femme de chambre, assez semblable à une religieuse,
TXM_etude_des_moeurs	à donner ? Couchée à une ou deux	heures du matin	, elle doit se lever assez matinalement pour repasser ses rôles,
TXM_etude_des_moeurs	quittant le monde entre une heure et deux	heures du matin	, il revenait travailler jusqu'à huit ou neuf heures, il
