Référence	ContexteGauche	Pivot	ContexteDroit
TXM_etude_des_moeurs	-il le fils, le frère, le	père	du défunt ? … demanda l’homme officiel. — Che zuis
TXM_etude_des_moeurs	pièce de cinq francs, en le sachant	père	de famille. — Ah ! Dobinard (Topinard) … s’
TXM_etude_des_moeurs	Tiens, voilà le convoi de ce pauvre	père	Cibot ! En voilà un travailleur de moins ! quel dévorant !
TXM_etude_des_moeurs	le départ d’un ami, d’un	père	, d’un fils, d’une femme aimée, pour la
TXM_etude_des_moeurs	ménage, lorsqu’à six heures, le	père	et la mère faisaient leur service au théâtre. Dans beaucoup de
TXM_etude_des_moeurs	donnerai la place de caissier, car le	père	Baudrand me quitte … — Ha ! que Tieu fus pénisse !
TXM_etude_des_moeurs	théâdre … — Moi, la place du	père	Baudrand ? — Ui. — Qui vous a dit cela ?
TXM_etude_des_moeurs	mon illustre ami, son bon et excellent	père	, à ce grand homme d’État, combien je suis dévoué
TXM_etude_des_moeurs	ne viennent pas à vous … — Mon	père	avait déjà, dit la vicomtesse Popinot, un noyau de collection
TXM_etude_des_moeurs	, il devint toute l’ambition de son	père	et de sa mère, qui le révèrent notaire à Paris.
TXM_etude_des_moeurs	leurs travaux obstinés. Les espérances que son	père	et sa mère, alors retirés du commerce, asseyaient sur sa
TXM_etude_des_moeurs	voulut être magistrat. En ce moment son	père	mourut. Sa mère, dont la vieillesse put se contenter de
TXM_etude_des_moeurs	âme malade de son fils ; mais le	père	avait cet esprit de calcul qui n’abandonne point un vieux commerçant
TXM_etude_des_moeurs	capitaux dans la maison de banque où son	père	avait eu des relations. Cette maison était la maison Mongenod et
TXM_etude_des_moeurs	parenté, après avoir valu à feu Mongenod	père	de grandes faveurs dans les opérations financières sous la Restauration, lui
TXM_etude_des_moeurs	été remboursée lors de la mort de Mongenod	père	, en 1827. Frédéric Mongenod, beau jeune homme de trente-cinq
TXM_etude_des_moeurs	un Anglais, avait acquis auprès de son	père	toutes les qualités nécessaires à sa difficile profession. Plus instruit que
TXM_etude_des_moeurs	il avait été lui -même formé par son	père	à toutes les sciences du vrai banquier, lequel est à l’
TXM_etude_des_moeurs	, Godefroid reconnut en quelle estime était son	père	, car il put traverser les bureaux et arriver au cabinet de
TXM_etude_des_moeurs	conseil financier à l’ancien banquier de mon	père	pour accorder ma fortune à un nouveau genre de vie. Godefroid
TXM_etude_des_moeurs	a-t -il pas lâché l’autre jour le	père	Marin, il lui a tout refusé. — Ah ! bah
TXM_etude_des_moeurs	refusé. — Ah ! bah ! le	père	Marin voulait faire des filouteries qui ne peuvent réussir qu’aux millionnaires
TXM_etude_des_moeurs	d’un travail pénible. Or, son	père	, avocat au grand conseil, lui avait laissé quelque fortune,
TXM_etude_des_moeurs	entre nous. À la mort de son	père	, en 1787, Mongenod s’était trouvé plus riche que moi
TXM_etude_des_moeurs	deux tiers de ses revenus, car son	père	avait placé sur la Ville la plus forte partie de ses capitaux
TXM_etude_des_moeurs	la petite femme est effectivement partie avec son	père	à l’époque où Mongenod avait annoncé ce départ à Bordin.
TXM_etude_des_moeurs	me dit -elle, le bienfaiteur de mon	père	ne sera jamais laid pour moi. Cette parole, dite spontanément
TXM_etude_des_moeurs	pouvons avoir besoin. Frédéric, car le	père	lui avait donné mon nom en Amérique, Frédéric Mongenod est,
TXM_etude_des_moeurs	à Paris une vie assez inquiétante pour un	père	de famille. Le mérite de mademoiselle de Champignelles obtenait quelque célébrité
TXM_etude_des_moeurs	furent pris entre les deux familles, le	père	fit venir son fils. Maître des requêtes au Grand-Conseil, et
TXM_etude_des_moeurs	fois payé des dettes considérables. Ce pauvre	père	, en prévision de nouvelles fautes chez son fils, était assez
TXM_etude_des_moeurs	quelques indices qui trahissaient le caractère aventureux du	père	, mais augmenté d’une fermeté presque virile. Ce mari s’
TXM_etude_des_moeurs	et Dubut-Boislaurier, capitaine de dragons. Le	père	avait donné les noms de trois différentes propriétés à ses fils,
TXM_etude_des_moeurs	messes par an. Quoique défendue par le	père	d’un grand orateur et l’un des célèbres avocats du temps
TXM_etude_des_moeurs	cette joie puérile, et dont rirait le	père	Alain. N’est -ce pas singulier, cependant, se dit
TXM_etude_des_moeurs	qui l’écoutait en effet. Je suis	père	, monsieur, et je n’ai plus au monde que ma
TXM_etude_des_moeurs	aux raisons et à la prière d’un	père	au désespoir ; il leur était indifférent de se loger dans telle
TXM_etude_des_moeurs	, ou, plutôt, Dieu conserve le	père	à l’enfant pour qu’elle ait une garde, une providence
TXM_etude_des_moeurs	qui méritait un pareil amour. Je suis	père	comme j’ai été mari, c’est tout vous dire en
TXM_etude_des_moeurs	la douleur … Jugez quel spectacle pour un	père	! Le monde pour ma fille, c’est sa chambre !
TXM_etude_des_moeurs	sa résolution de devenir un émule du bon	père	Alain fut inébranlable. Sans avoir la vocation, il eut la
TXM_etude_des_moeurs	, devait ignorer la situation réelle de son	père	et de son fils. La douillette de soie de monsieur Bernard
TXM_etude_des_moeurs	rue Notre-Dame-des-Champs, indiquaient les occupations nocturnes du	père	et du fils. Il y avait sur les deux tables deux
TXM_etude_des_moeurs	monsieur Bernard ; car sur le lit du	père	, il vit l’habillement qu’il lui avait vu la veille
TXM_etude_des_moeurs	je vous ai vu donnant votre bois au	père	Bernard. Ah ! vous êtes un finaud ! Nom d’une
TXM_etude_des_moeurs	telles souffrances, dans le cœur d’un	père	, éteignent tout autre sentiment, et l’amour de la gloire
TXM_etude_des_moeurs	évidemment la plus grande concession que le pauvre	père	pût faire ; et, au regard de remercîment que lui jeta
TXM_etude_des_moeurs	cette chambre, où le médecin, le	père	et le fils étaient seuls entrés depuis six ans. Néanmoins il
TXM_etude_des_moeurs	malade : il comprit la nécessité pour le	père	et pour le fils d’être bien vêtus. En effet,
TXM_etude_des_moeurs	excitée en moi depuis le moment où mon	père	m’a annoncé votre visite … Non, c’était une curiosité
TXM_etude_des_moeurs	à celle de notre mère Ève … Mon	père	, si bon pour moi, mon fils, que j’aime
TXM_etude_des_moeurs	n’ai pas d’autres serviteurs que mon	père	et mon fils, et je n’en pourrais plus supporter d’
TXM_etude_des_moeurs	ils me manquaient, je mourrais … Mon	père	ne veut pas que Jean, un pauvre Normand qui nous sert
TXM_etude_des_moeurs	… — Ah ! madame, monsieur votre	père	a bien raison … — Et pourquoi ? … dit -elle.
TXM_etude_des_moeurs	Si Jean avait gâté ma chambre, mon	père	l’aurait renouvelée. — Oui, mon enfant ; mais ce
TXM_etude_des_moeurs	prenant les précautions minutieuses dont sont capables un	père	et un fils, nous t’avons évité le balayage, la
TXM_etude_des_moeurs	c’est pour votre santé. Monsieur votre	père	a raison. — Je ne me plains pas, répliqua Vanda
TXM_etude_des_moeurs	pensée ! Je lis beaucoup. Puis mon	père	me raconte les choses du monde … En entendant ce mot,
TXM_etude_des_moeurs	voudrais être guérie, d’abord pour mon	père	, qui vit uniquement pour moi, comme je vis par lui
TXM_etude_des_moeurs	monsieur, quels êtres accomplis que mon vieux	père	… que mon excellent fils … mais aussi pour entendre Lablache,
TXM_etude_des_moeurs	sa famille ayant eu quelques obligations à mon	père	, le premier président, il nous remercia par ce chef-d’œuvre,
TXM_etude_des_moeurs	belle vie, ajouta-t -elle en regardant son	père	et lui jetant toute son âme dans ce regard. Ah !
TXM_etude_des_moeurs	, si vous saviez ce qu’est mon	père	. Qui jamais pourrait croire que ce grand et sévère magistrat,
TXM_etude_des_moeurs	voudrez ! s’écria-t -elle en regardant son	père	et son fils. Il y a des moments, mon père
TXM_etude_des_moeurs	. Il y a des moments, mon	père	, où les idées de monsieur de Maistre me travaillent, et
TXM_etude_des_moeurs	cela sert ? — Vanda ! dit le	père	, allons, calme -toi, ma fille ? tiens, voici
TXM_etude_des_moeurs	ses pas, à la suite de son	père	, marchand ambulant de son état. Il ne faut pas croire
TXM_etude_des_moeurs	bien ! lui dit -il, notre cher	père	Alain n’est pas avec vous ? — Il ne viendra pas
TXM_etude_des_moeurs	Rossini ; elle pleurait de ce que son	père	, qu’elle croyait tout-puissant, refusait de le lui amener.
TXM_etude_des_moeurs	, car elle ignorait les démarches de son	père	. Monsieur Bernard avait recommandé le silence à son petit-fils sur ses
TXM_etude_des_moeurs	-vous, monsieur, que mon bon vieux	père	invente pour moi des histoires admirables lorsque je n’ai plus de
TXM_etude_des_moeurs	Pinska. — Bien. Monsieur est votre	père	? — Oui, monsieur. — Monsieur, demanda-t -il,
TXM_etude_des_moeurs	vingt minutes que dura le récit alternatif du	père	et de la fille. — Quel âge a madame ? —
TXM_etude_des_moeurs	venir voir madame, puisque vous êtes son	père	. — Est -ce sûr ? demanda monsieur Bernard. — Sûr
TXM_etude_des_moeurs	, quasi liée au matelas, tant le	père	craignit les soubresauts d’une attaque de nerfs. Enfin, parti
TXM_etude_des_moeurs	qu’il ignorait ce qu’était devenu le	père	de la malade amenée à quatre heures et demie, mais que
TXM_etude_des_moeurs	de ne laisser personne, pas même le	père	, voir cette dame d’ici à huit jours, sous peine
TXM_etude_des_moeurs	, est la baronne de Mergi ; mon	père	est le fils du premier président de la Cour royale de Rouen
TXM_etude_des_moeurs	du matin dans ce quartier, le pauvre	père	, au désespoir, erra sur le quai, sous les arbres
TXM_etude_des_moeurs	pauvre jeune homme venait d’apprendre que le	père	de la dame amenée la veille était revenu dans la soirée,
TXM_etude_des_moeurs	fils le conservera comme une relique ! Mon	père	vous a cherché dans tout Paris ; il est, d’ailleurs
TXM_etude_des_moeurs	. Oh ! nous sommes très-bien. Mon	père	croit que vous êtes pour beaucoup dans les félicités qui nous accablent
TXM_etude_des_moeurs	de législation comparée à la Sorbonne ? Mon	père	commencera son premier cours au mois de novembre prochain. Le grand
TXM_etude_des_moeurs	le publie en partageant les bénéfices avec mon	père	, et elle lui a remis trente mille francs à-compte sur sa
TXM_etude_des_moeurs	francs à-compte sur sa part ; aussi mon	père	achète-t -il la maison où nous sommes. Le ministère de la
TXM_etude_des_moeurs	la fille d’un ancien magistrat ; mon	père	a sa pension de mille écus ; il a cinq mille francs
TXM_etude_des_moeurs	ancien président de la cour royale que mon	père	n’a jamais vu, le procureur-général a fait anéantir le procès-verbal
TXM_etude_des_moeurs	Halpersohn demandait grâce pour lui ; mais mon	père	, qui me refuse, moi qu’il aime tant, a
TXM_etude_des_moeurs	a dit Halpersohn que j’écoutais. Mon	père	a gardé le silence. — Mais qui donc vous a secourus
TXM_etude_des_moeurs	sec, triste dans le genre de mon	père	… C’est lui qui fit transporter mon père dans la maison
TXM_etude_des_moeurs	… C’est lui qui fit transporter mon	père	dans la maison où nous sommes, lorsqu’il fut atteint de
TXM_etude_des_moeurs	. Figurez -vous que, dès que mon	père	fut rétabli, l’on m’a retirée de la maison de
TXM_etude_des_moeurs	alors appris toutes les souffrances endurées par mon	père	! Et les diamants vendus de sa tabatière ! mon fils et
TXM_etude_des_moeurs	de sa tabatière ! mon fils et mon	père	la plupart du temps sans pain et faisant les riches en ma
TXM_etude_des_moeurs	martyrs … Que puis -je dire à mon	père	? … Entre mon fils et lui, je ne peux que
TXM_etude_des_moeurs	s’ouvrit, et cria : — Mon	père	! monsieur Godefroid connaît ton bienfaiteur. Le baron Bourlac, que
TXM_etude_des_moeurs	si vous tenez à la raison de votre	père	, faites qu’il reste dans son ignorance, qu’il ne
TXM_etude_des_moeurs	moindre démarche ! Un étonnement profond glaça le	père	, la fille et Auguste. — C’est ? demanda Vanda
TXM_etude_des_moeurs	véritables Lora, son frère aîné, son	père	et une vieille tante paternelle, mademoiselle Urraca y Lora. Dans
TXM_etude_des_moeurs	. — En êtes -vous bien sûr,	père	Fromenteau ? demanda Gaillard, voici onze fois que nous le tenons
TXM_etude_des_moeurs	, elle était élève du Conservatoire ; le	père	lisait un journal, et madame Ravenouillet tenait à la main des
TXM_etude_des_moeurs	A ces traits principaux, vous devinez le	père	de famille harassé par des contrariétés au sein du ménage, tourmenté
TXM_etude_des_moeurs	mystérieuses ; il n’avait jamais connu son	père	; sa mère, femme chez qui le luxe éclatait, toujours
TXM_etude_des_moeurs	, homme veuf, passant pour très-riche et	père	d’une fille unique. Xavier Rabourdin devint éperdument amoureux de mademoiselle
TXM_etude_des_moeurs	voulait pas se nommer madame Rabourdin. Le	père	dit à sa fille que Rabourdin était du bois dont on faisait
TXM_etude_des_moeurs	etc. Forcé dans ses retranchements, le	père	commit une grave indiscrétion en déclarant à sa fille que son futur
TXM_etude_des_moeurs	de rente pour défrayer un ménage composé du	père	, de la mère, de deux enfants, d’une femme
TXM_etude_des_moeurs	mâle, lors de la mort de son	père	. La plupart des femmes se fatiguent dans cette lutte journalière,
TXM_etude_des_moeurs	ou d’un grand propriétaire chez qui son	père	a tiré le cordon de la porte. Le dernier venu peut
TXM_etude_des_moeurs	par un mouvement de son fouet le pauvre	père	de famille à pied, en disant : _Voilà mon chef !
TXM_etude_des_moeurs	ménage avec Berthier, et Richelieu avec le	père	Joseph : des Lupeaulx faisait ménage avec tout le monde. Il
TXM_etude_des_moeurs	tapis turcs, bonne occasion saisie par son	père	, en les y encadrant dans de vieux ébènes, d’un
TXM_etude_des_moeurs	hôtes par cet ensemble. Grâce à son	père	, dès que le _rococo_ fut à la mode, Célestine fit
TXM_etude_des_moeurs	. Personne ne doutait au Ministère que le	père	Saillard ne fût une bête, mais personne n’avait jamais pu
TXM_etude_des_moeurs	la Place-Royale. A l’heure où le	père	Saillard voyageait dans Paris, son gendre et sa chère Élisabeth étaient
TXM_etude_des_moeurs	fille unique marchait, suivant un mot du	père	Saillard, sur la queue de ses douze ans, avait jeté
TXM_etude_des_moeurs	voulait avancer. Dire la vie de son	père	et de sa mère, dira toute la femme en peignant l’
TXM_etude_des_moeurs	canard aux navets ; mais, selon le	père	Saillard, Élisabeth n’avait pas sa pareille pour savoir accommoder aux
TXM_etude_des_moeurs	de la maison et les habits de son	père	. Sans cesse occupée comme une servante, elle ne sortait jamais
TXM_etude_des_moeurs	et les devoirs de la religion, son	père	et sa mère la conduisaient devant le café Turc, où ils
TXM_etude_des_moeurs	par mois pour son entretien ; mais son	père	, qui l’aimait beaucoup, tempérait cette rigueur par quelques présents
TXM_etude_des_moeurs	l’Ile-Adam. Monsieur et madame Baudoyer,	père	et mère d’Isidore, honnêtes mégissiers de la rue Censier,
TXM_etude_des_moeurs	ne changèrent. On fêtait les saints du	père	, de la mère, du gendre, de la fille et
TXM_etude_des_moeurs	audace de renoncer à l’établissement de son	père	pour aborder les Bureaux, où il était parvenu à un poste
TXM_etude_des_moeurs	un profond respect, honorant en lui le	père	de sa fille, son mari, le pouvoir temporel, disait
TXM_etude_des_moeurs	ne rien faire sans la consulter. Le	père	Saillard disait naïvement : « Est -elle fûtée, ct’Élisabeth ? »
TXM_etude_des_moeurs	sa fille seule, elle avait décidé son	père	à l’acte exorbitant de son association avec Falleix. Falleix avait
TXM_etude_des_moeurs	ici pour rien, ma mère. --Ton	père	a quelque chose, dit Baudoyer à sa femme quand le caissier
TXM_etude_des_moeurs	que j’aie le bonheur de conserver mon	père	? Le matin même l’héritier avait fait une transposition en mettant
TXM_etude_des_moeurs	valu près de quatre mille francs au gros	père	Thuillier, dont le fils était un des employés de la Division
TXM_etude_des_moeurs	était un rédacteur du Bureau Rabourdin, honorable	père	de famille, nommé monsieur Phellion. Il devait à la protection
TXM_etude_des_moeurs	terre achetés à perpétuité, dans lesquels son	père	et la mère de sa femme avaient été enterrés. « Nous
TXM_etude_des_moeurs	un Rabourdin, il mourrait le plus heureux	père	du monde. Il rebattait si bien l’éloge de ce digne
TXM_etude_des_moeurs	avait fini par y renoncer. Monsieur Vimeux	père	était greffier d’une Justice de Paix dans le département du Nord
TXM_etude_des_moeurs	petit-fils d’un épicier de Paris. Son	père	mort colonel l’avait laissé à la charge de sa grand’mère,
TXM_etude_des_moeurs	la main au fils sur la fosse du	père	en lui assurant sa pratique. L’ami de tous ses fournisseurs
TXM_etude_des_moeurs	cœur attendait avec impatience la mort de son	père	pour succéder à un titre de baron accordé récemment, il mettait
TXM_etude_des_moeurs	tête et sans voir Baudoyer_). Le	père	La Billardière est enfoncé, messieurs ! Rabourdin est Chef de Division
TXM_etude_des_moeurs	La Billardière quitte la Division de défunt son	père	et passe à la Commission du Sceau, c’est comme si
TXM_etude_des_moeurs	). Il est onze heures, le	père	Poiret se mouche. DU BRUEL. C’est vrai. Déjà
TXM_etude_des_moeurs	devait se taire. --Certainement, dit le	père	Saillard en pensant à sa commandite. --Vous êtes arrivé, j’
TXM_etude_des_moeurs	! --Cher monsieur Gaudron, aidez donc mon	père	à composer une phrase qu’il pourrait glisser dans l’oreille de
TXM_etude_des_moeurs	Baudoyer sortit donc sans rien expliquer à son	père	ni à son mari. --Le ciel, dit monsieur Gaudron à
TXM_etude_des_moeurs	Gaudron. --Écris, Baudoyer, cria le	père	Saillard, écris la phrase. Baudoyer prit naïvement une plume et
TXM_etude_des_moeurs	chez monsieur Dutocq. Un fameux secret,	père	Antoine : ne dites rien aux employés ; parole ! il me
TXM_etude_des_moeurs	doigt un passage_). Vous voilà,	père	Saillard. SAILLARD. _La caisse est à supprimer dans tous les
TXM_etude_des_moeurs	c’est sans intrigue, s’écria le	père	Saillard. Nous ne sommes pas intrigants, nous autres ! nous
TXM_etude_des_moeurs	ne savait que penser de l’aveuglement du	père	Saillard et de Baudoyer. Messieurs Dutocq, Bixiou, du Bruel
TXM_etude_des_moeurs	vos travaux. Monsieur et madame Baudoyer,	père	et mère du nouveau directeur, étaient là jouissant de la gloire
TXM_etude_des_moeurs	ainsi que Clément Chardin des Lupeaulx dont le	père	, anobli sous Louis XV, portait _écartelé au premier d’argent
TXM_etude_des_moeurs	À ces traits principaux, vous devinez le	père	de famille harassé par des contrariétés au sein du ménage, tourmenté
TXM_etude_des_moeurs	mystérieuses : il n’avait jamais connu son	père	; sa mère, femme chez qui le luxe éclatait, toujours
TXM_etude_des_moeurs	, homme veuf, passant pour très-riche et	père	d’une fille unique. Xavier Rabourdin devint éperdument amoureux de mademoiselle
TXM_etude_des_moeurs	voulait pas se nommer madame Rabourdin. Le	père	dit à sa fille que Rabourdin était du bois dont on faisait
TXM_etude_des_moeurs	. etc. Forcé dans ses retranchements le	père	commit une grave indiscrétion en déclarant à sa fille que son futur
TXM_etude_des_moeurs	de rente pour défrayer un ménage composé du	père	, de la mère, de deux enfants, d’une femme
TXM_etude_des_moeurs	mâle, lors de la mort de son	père	. La plupart des femmes se fatiguent dans cette lutte journalière,
TXM_etude_des_moeurs	ou d’un grand propriétaire chez qui son	père	a tiré le cordon de la porte. Le dernier venu peut
TXM_etude_des_moeurs	par un mouvement de son fouet le pauvre	père	de famille à pied, en disant : Voilà mon chef !
TXM_etude_des_moeurs	ménage avec Berthier, et Richelieu avec le	père	Joseph : des Lupeaulx faisait ménage avec tout le monde. Il
TXM_etude_des_moeurs	tapis turcs, bonne occasion saisie par son	père	, en les y encadrant dans de vieux ébènes, d’un
TXM_etude_des_moeurs	hôtes par cet ensemble. Grâce à son	père	, dès que le rococo fut à la mode, Célestine fit
TXM_etude_des_moeurs	. Personne ne doutait au Ministère que le	père	Saillard ne fût une bête, mais personne n’avait jamais pu
TXM_etude_des_moeurs	la Place-Royale. À l’heure où le	père	Saillard voyageait dans Paris, son gendre et sa chère Elisabeth étaient
TXM_etude_des_moeurs	fille unique marchait, suivant un mot du	père	Saillard, sur la queue de ses douze ans, avait jeté
TXM_etude_des_moeurs	voulait avancer. Dire la vie de son	père	et de sa mère, dira toute la femme en peignant l’
TXM_etude_des_moeurs	canard aux navets ; mais, selon le	père	Saillard, Elisabeth n’avait pas sa pareille pour savoir accommoder aux
TXM_etude_des_moeurs	de la maison et les habits de son	père	. Sans cesse occupée comme une servante, elle ne sortait jamais
TXM_etude_des_moeurs	et les devoirs de la religion, son	père	et sa mère la conduisaient devant le café Turc, où ils
TXM_etude_des_moeurs	par mois pour son entretien ; mais son	père	, qui l’aimait beaucoup, tempérait cette rigueur par quelques présents
TXM_etude_des_moeurs	l’Ile-Adam. Monsieur et madame Baudoyer,	père	et mère d’lsidore, honnêtes mégissiers de la rue Censier,
TXM_etude_des_moeurs	ne changèrent. On fêtait les saints du	père	, de la mère, du gendre, de la fille et
TXM_etude_des_moeurs	audace de renoncer à l’établissement de son	père	pour aborder les Bureaux, où il était parvenu à un poste
TXM_etude_des_moeurs	un profond respect, honorant en lui le	père	de sa fille, son mari, le pouvoir temporel, disait
TXM_etude_des_moeurs	ne rien faire sans la consulter. Le	père	Saillard disait naïvement : « Est -elle futée, ct’Elisabeth ? »
TXM_etude_des_moeurs	sa fille seule, elle avait décidé son	père	à l’acte exorbitant de son association avec Falleix. Falleix avait
TXM_etude_des_moeurs	pour rien, ma mère. — Ton	père	a quelque chose, dit Baudoyer à sa femme quand le caissier
TXM_etude_des_moeurs	que j’aie le bonheur de conserver mon	père	? Le matin même l’héritier avait fait une transposition en mettant
TXM_etude_des_moeurs	valu près de quatre mille francs au gros	père	Thuillier, dont le fils était un des employés de la Division
TXM_etude_des_moeurs	était un rédacteur du Bureau Rabourdin, honorable	père	de famille, nommé monsieur Phellion. Il devait à la protection
TXM_etude_des_moeurs	terre achetés à perpétuité, dans lesquels son	père	et la mère de sa femme avaient été enterrés. « Nous
TXM_etude_des_moeurs	un Rabourdin, il mourrait le plus heureux	père	du monde. Il rebattait si bien l’éloge de ce digne
TXM_etude_des_moeurs	avait fini par y renoncer. Monsieur Vimeux	père	était greffier d’une Justice de paix dans le département du Nord
TXM_etude_des_moeurs	petit-fils d’un épicier de Paris. Son	père	mort colonel l’avait laissé à la charge de sa grand’mère,
TXM_etude_des_moeurs	la main au fils sur la fosse du	père	en lui assurant sa pratique. L’ami de tous ses fournisseurs
TXM_etude_des_moeurs	cœur attendait avec impatience la mort de son	père	pour succéder à un titre de baron accordé récemment, il mettait
TXM_etude_des_moeurs	tête et sans voir Baudoyer). Le	père	La Billardière est enfoncé, messieurs ! Rabourdin est Chef de Division
TXM_etude_des_moeurs	La Billardière quitte la Division du défunt son	père	et passe à la Commission du Sceau, c’est comme si
TXM_etude_des_moeurs	). Il est onze heures, le	père	Poiret se mouche. DU BRUEL. C’est vrai. Déjà
TXM_etude_des_moeurs	se taire. — Certainement, dit le	père	Saillard en pensant à sa commandite. — Vous êtes arrivé,
TXM_etude_des_moeurs	! — Cher monsieur Gaudron, aidez-donc mon	père	à composer une phrase qu’il pourrait glisser dans l’oreille de
TXM_etude_des_moeurs	Baudoyer sortit donc sans rien expliquer à son	père	ni à son mari. — Le ciel, dit monsieur Gaudron
TXM_etude_des_moeurs	. — Ecris, Baudoyer, cria le	père	Saillard, écris la phrase. Baudoyer prit naïvement une plume et
TXM_etude_des_moeurs	chez monsieur Dutocq. Un fameux secret,	père	Antoine : ne dites rien aux employés ; parole ! il me
TXM_etude_des_moeurs	doigt un passage). Vous voilà,	père	Saillard. SAILLARD. La caisse est à supprimer dans tous les
TXM_etude_des_moeurs	c’est sans intrigue, s’écria le	père	Saillard. Nous ne sommes pas intrigants, nous autres ! nous
TXM_etude_des_moeurs	ne savait que penser de l’aveuglement du	père	Saillard et de Baudoyer. Messieurs Dutocq, Bixiou, du Bruel
TXM_etude_des_moeurs	vos travaux. Monsieur et madame Baudoyer,	père	et mère du nouveau directeur, étaient là jouissant de la gloire
TXM_etude_des_moeurs	ainsi que Clément Chardin des Lupeaulx dont le	père	, anobli sous Louis XV, portait écartelé au premier d’argent
TXM_etude_des_moeurs	toutes les réquisitions et conscriptions possibles. Le	père	eut l’ambition de faire de son fils un employé. Dans
TXM_etude_des_moeurs	le manque d’employés inférieurs permit au gros	père	Thuillier de faire franchir à son fils les premiers degrés de la
TXM_etude_des_moeurs	resté à la classe dite seconde, son	père	ayant voulu profiter d’une occasion pour le faire entrer au ministère
TXM_etude_des_moeurs	connue, privilégiée grâce aux protecteurs de son	père	, et qui consistait à fabriquer des sacs pour la Banque,
