Référence	ContexteGauche	Pivot	ContexteDroit
TXM_etude_des_moeurs	faire des dominos avec les os de son	père	; un juif, un arabe, un grec, un bohémien
TXM_etude_des_moeurs	— Qu’est -ce que fait donc ce	père	Goriot ? — Il ne fait rien, dit Vautrin, il
TXM_etude_des_moeurs	dit Sylvie. — Christophe, cria le	père	Goriot, monte avec moi. Christophe suivit le père Goriot,
TXM_etude_des_moeurs	, monte avec moi. Christophe suivit le	père	Goriot, et redescendit bientôt. — Où vas -tu ? dit
TXM_etude_des_moeurs	bon Dieu d’attendrir le cœur de votre	père	, dit Vautrin en avançant une chaise à l’orpheline. Mais
TXM_etude_des_moeurs	Allez, mon chou, votre monstre de	père	attire le malheur à plaisir sur lui. À ces mots.
TXM_etude_des_moeurs	vous saviez un moyen d’arriver à mon	père	, dites -lui bien que son affection et l’honneur de ma
TXM_etude_des_moeurs	les pensionnaires, et s’assit auprès du	père	Goriot. — Il vient de m’arriver une singulière aventure,
TXM_etude_des_moeurs	, l’étudiant regarda fixement Vautrin. Le	père	Goriot leva brusquement la tête, il jeta sur les deux interlocuteurs
TXM_etude_des_moeurs	ah ! voilà, répondit Vautrin. Le	père	Goriot le savait bien, lui ! pourquoi ne le saurais -je
TXM_etude_des_moeurs	furieusement belle, reprit Eugène, que le	père	Goriot regardait avidement. Si madame de Beauséant n’avait pas été
TXM_etude_des_moeurs	. Connu, connu ! Le visage du	père	Goriot, qui s’était allumé comme le soleil d’un beau
TXM_etude_des_moeurs	. Quand les deux dames sortirent, le	père	Goriot les imita. — Eh bien, l’avez -vous vu
TXM_etude_des_moeurs	que la belle comtesse de Restaud appartienne au	père	Goriot. — Mais, lui dit Vautrin en l’interrompant,
TXM_etude_des_moeurs	pour lui apporter leur dernier écu. Le	père	Goriot est un de ces gens -là. La comtesse l’exploite
TXM_etude_des_moeurs	vieil escompteur il y avait urgence. Le	père	Goriot a galamment financé pour elle. Il ne faut pas coudre
TXM_etude_des_moeurs	Comment, s’écria madame Vauquer, le	père	Goriot aurait fondu son déjeuner de vermeil ? — N’y avait
TXM_etude_des_moeurs	s’est jetée alors aux pieds de son	père	, et lui a dit avec courage qu’elle n’insistait autant
TXM_etude_des_moeurs	C’est donc des monstres ? dit le	père	Goriot. — Et puis, dit madame Couture sans faire attention
TXM_etude_des_moeurs	attention à l’exclamation du bonhomme, le	père	et le fils s’en sont allés en me saluant et me
TXM_etude_des_moeurs	! dit Vautrin. Dérangez -vous donc,	père	Goriot ! Que diable ! votre pied prend toute la gueule du
TXM_etude_des_moeurs	la porte par laquelle on servait, le	père	Goriot leva la tête en flairant un morceau de pain qu’il
TXM_etude_des_moeurs	autant plus à rire, que le pauvre	père	Goriot regardait les convives d’un air niais, comme un homme
TXM_etude_des_moeurs	! dit Vautrin en enfonçant le chapeau du	père	Goriot par une tape qu’il lui appliqua sur la tête et
TXM_etude_des_moeurs	Eh ! eh ! voyez donc comme le	père	Goriot examine mademoiselle Victorine. Le vieillard oubliait de manger pour contempler
TXM_etude_des_moeurs	douleur de l’enfant méconnu qui aime son	père	. — Mon cher, dit Eugène à voix basse, nous
TXM_etude_des_moeurs	basse, nous nous sommes trompés sur le	père	Goriot. Ce n’est ni un imbécile ni un homme sans
TXM_etude_des_moeurs	voix de madame de Restaud, celle du	père	Goriot et le bruit d’un baiser. Il rentra dans la
TXM_etude_des_moeurs	la cour. Il voulait voir si ce	père	Goriot était bien réellement son père Goriot, Le cœur lui battait
TXM_etude_des_moeurs	si ce père Goriot était bien réellement son	père	Goriot, Le cœur lui battait étrangement, il se souvenait des
TXM_etude_des_moeurs	l’antichambre. En ce moment, le	père	Goriot débouchait près de la porte cochère par la sortie du petit
TXM_etude_des_moeurs	homme décoré qui conduisait un tilbury. Le	père	Goriot n’eut que le temps de se jeter en arrière pour
TXM_etude_des_moeurs	d’un air de colère, regarda le	père	Goriot, et lui fit, avant qu’il ne sortît,
TXM_etude_des_moeurs	mais dont on rougit plus tard. Le	père	Goriot répondit par un petit salut amical, plein de bonhomie.
TXM_etude_des_moeurs	ténébreuse pour lui. La Maison-Vauquer, le	père	Goriot étaient alors bien loin de sa pensée. — Je croyais
TXM_etude_des_moeurs	de savoir quelles étaient ses relations avec le	père	Goriot. Cette femme, évidemment amoureuse de Maxime ; cette femme
TXM_etude_des_moeurs	à porte dans la même pension, le	père	Goriot. À ce nom enjolivé du mot père, le comte
TXM_etude_des_moeurs	Goriot. À ce nom enjolivé du mot	père	, le comte, qui tisonnait, jeta les pincettes dans le
TXM_etude_des_moeurs	la comtesse. En prononçant le nom du	père	Goriot, Eugène avait donné un coup de baguette magique, mais
TXM_etude_des_moeurs	gants jaunes le soir ! Vieux drôle de	père	Goriot, va ! Quand il se trouva sous la porte de
TXM_etude_des_moeurs	cousine d’une manière solidement aristocratique. Le	père	Goriot me coûte déjà au moins dix francs, le vieux scélérat
TXM_etude_des_moeurs	cent trente francs pour son trimestre. Son	père	, sa mère, ses frères, ses sœurs, sa tante
TXM_etude_des_moeurs	ai faite. J’ai parlé d’un	père	… — Madame la duchesse de Langeais, dit Jacques en coupant
TXM_etude_des_moeurs	duchesse. — Ah ! c’est son	père	, reprit l’étudiant en faisant un geste d’horreur. —
TXM_etude_des_moeurs	la perdra. — Elles ont renié leur	père	, répétait Eugène. — Eh ! bien, oui, leur
TXM_etude_des_moeurs	— Eh ! bien, oui, leur	père	, le père, un père, reprit la vicomtesse, un
TXM_etude_des_moeurs	bien, oui, leur père, le	père	, un père, reprit la vicomtesse, un bon père qui
TXM_etude_des_moeurs	, leur père, le père, un	père	, reprit la vicomtesse, un bon père qui leur a donné
TXM_etude_des_moeurs	père, reprit la vicomtesse, un bon	père	qui leur a donné, dit -on, à chacune cinq ou
TXM_etude_des_moeurs	Les filles, qui aimaient peut-être toujours leur	père	, ont voulu ménager la chèvre et le chou, le père
TXM_etude_des_moeurs	ménager la chèvre et le chou, le	père	et le mari ; elles ont reçu le Goriot quand elles n’
TXM_etude_des_moeurs	s’est sacrifié, parce qu’il était	père	: il s’est banni de lui -même. En voyant ses
TXM_etude_des_moeurs	comprit qu’il avait bien fait. Le	père	et les enfants ont été complices de ce petit crime. Nous
TXM_etude_des_moeurs	crime. Nous voyons cela partout. Ce	père	Doriot n’aurait -il pas été une tache de cambouis dans le
TXM_etude_des_moeurs	serait ennuyé. Ce qui arrive à ce	père	peut arriver à la plus jolie femme avec l’homme qu’elle
TXM_etude_des_moeurs	pas avoir un sou à lui. Ce	père	avait tout donné. Il avait donné, pendant vingt ans,
TXM_etude_des_moeurs	tête en regardant le cousin. — Le	père	Goriot est sublime ! dit Eugène en se souvenant de l’avoir
TXM_etude_des_moeurs	épouvantable que ne l’est l’abandon du	père	par ses deux filles, qui le voudraient mort. C’est
TXM_etude_des_moeurs	se renient entre elles comme elles renient leur	père	. Aussi, madame de Nucingen laperait -elle toute la boue qu’
TXM_etude_des_moeurs	la comtesse pour avoir prononcé le nom du	père	Goriot. Oui, mon cher, vous iriez vingt fois chez
TXM_etude_des_moeurs	consigné. Eh ! bien, que le	père	Goriot vous introduise près de madame Delphine de Nucingen. La belle
TXM_etude_des_moeurs	sa porte pour lui avoir dit que son	père	mangeait à notre table, s’écria Rastignac. Tous les convives
TXM_etude_des_moeurs	. Tous les convives s’entre-regardèrent. Le	père	Goriot baissa les yeux, et se retourna pour les essuyer.
TXM_etude_des_moeurs	à son voisin. — Qui vexera le	père	Goriot s’attaquera désormais à moi, répondit Eugène en regardant le
TXM_etude_des_moeurs	dit en goguenardant : — Pour prendre le	père	Goriot à votre compte, et vous établir son éditeur responsable,
TXM_etude_des_moeurs	Le dîner devint sombre et froid. Le	père	Goriot, absorbé par la profonde douleur que lui avait causée la
TXM_etude_des_moeurs	Vauquer à voix basse, serait donc le	père	d’une comtesse à c’t’heure ? — Et d’une
TXM_etude_des_moeurs	. Il se leva sans vouloir écouter le	père	Goriot, et se retira dans sa chambre, où il écrivit
TXM_etude_des_moeurs	Ne dis rien de ma demande a mon	père	, il s’y opposerait peut-être, et si je n’avais
TXM_etude_des_moeurs	dans une agitation pleine de désespoir. Le	père	Goriot, le voyant ainsi par sa porte qui était restée entrebâillée
TXM_etude_des_moeurs	suis encore fils et frère comme vous êtes	père	. Vous avez raison de trembler pour la comtesse Anastasie, elle
TXM_etude_des_moeurs	Maxime de Trailles qui la perdra. Le	père	Goriot se retira en balbutiant quelques paroles dont Eugène ne saisit pas
TXM_etude_des_moeurs	mettre au fait de la vie antérieure du	père	Goriot, et recueillit des renseignements certains, qui peuvent se réduire
TXM_etude_des_moeurs	exprimer les plus coûteux désirs pour voir leur	père	s’empressant de les combler ; il ne demandait qu’une caresse
TXM_etude_des_moeurs	dot la moitié de la fortune de son	père	. Courtisée pour sa beauté par le comte de Restaud, Anastasie
TXM_etude_des_moeurs	savait un monsieur Muret sur le compte du	père	Goriot, dont il avait acheté le fonds. Les suppositions que
TXM_etude_des_moeurs	fois une somme si considérable sans que ton	père	en fût instruit, ce qui troublerait l’harmonie de notre ménage
TXM_etude_des_moeurs	avait pas la goutte aux doigts. Ton	père	va bien. La récolte de 1819 passe nos espérances. Adieu
TXM_etude_des_moeurs	il était en pleurs, il pensait au	père	Goriot tordant son vermeil et le vendant pour aller payer la lettre
TXM_etude_des_moeurs	chez madame de Restaud, la fille du	père	Goriot, et vous y avez flairé la Parisienne. Ce jour
TXM_etude_des_moeurs	. Vous avez vu le pauvre bêta de	père	Goriot obligé de payer la lettre de change endossée par sa fille
TXM_etude_des_moeurs	Vautrin, et tout s’éclaircira. Le	père	Taillefer est un vieux coquin qui passe pour avoir assassiné l’un
TXM_etude_des_moeurs	et gentille, elle aura bientôt entortillé son	père	, et le fera tourner comme une toupie d’Allemagne avec le
TXM_etude_des_moeurs	un gentilhomme ! — Monsieur, dit le	père	Goriot en entrant chez Eugène, vous m’avez demandé si je
TXM_etude_des_moeurs	Comment avez -vous su cela, mon bon	père	Goriot ? dit Eugène en le faisant asseoir à son feu.
TXM_etude_des_moeurs	jours les deux voisins, Eugène et le	père	Goriot, étaient devenus bons amis. Leur secrète amitié tenait aux
TXM_etude_des_moeurs	plus riches trésors de l’amour. Le	père	Goriot, que son sentiment irréfléchi élevait jusqu’au sublime de la
TXM_etude_des_moeurs	une indiscrétion pourrait le bien servir. Le	père	Goriot ne lui avait parlé de ses filles qu’à propos de
TXM_etude_des_moeurs	m’aiment bien. Je suis un heureux	père	. Seulement, mes deux gendres se sont mal conduits envers moi
TXM_etude_des_moeurs	. Je suis le voisin de monsieur votre	père	. J’ignorais que madame de Restaud fût sa fille. J’
TXM_etude_des_moeurs	Puis, tout plein de ce que votre	père	m’a raconté ; ce soir en dînant avec ma cousine,
TXM_etude_des_moeurs	manière dont elle se conduit avec ce pauvre	père	, qui vraiment a été pour nous un dieu. Il a
TXM_etude_des_moeurs	Nucingen m’ordonnât positivement de ne voir mon	père	que le matin, pour que je cédasse sur ce point.
TXM_etude_des_moeurs	vous parler ainsi. Mais vous connaissez mon	père	, et, à ce titre, vous ne pouvez pas m’
TXM_etude_des_moeurs	Molière, puis récemment Jenny Deans et son	père	, dans l’œuvre de Walter Scott. Peut être l’œuvre
TXM_etude_des_moeurs	. L’étudiant frappa rudement à porte du	père	Goriot. — Mon voisin, dit -il, j’ai vu
TXM_etude_des_moeurs	se trouvait pour la première fois chez le	père	Goriot, ne fut pas maître d’un mouvement de stupéfaction en
TXM_etude_des_moeurs	stupéfaction en voyant le bouge où vivait le	père	, après avoir admiré la toilette de la fille. La fenêtre
TXM_etude_des_moeurs	noyer, dont la barre avait servi au	père	Goriot à dénaturer son écuelle en vermeil. Un méchant secrétaire sur
TXM_etude_des_moeurs	son grenier, que ne l’était le	père	Goriot chez madame Vauquer. L’aspect de cette chambre donnait froid
TXM_etude_des_moeurs	bien aussi. Je le sais. Un	père	est avec ses enfants comme Dieu est avec nous, il va
TXM_etude_des_moeurs	chagrins que les leurs. Quand vous serez	père	, quand vous vous direz, en oyant gazouiller vos enfants :
TXM_etude_des_moeurs	Eh ! bien, quand j’ai été	père	, j’ai compris Dieu. Il est tout entier partout,
TXM_etude_des_moeurs	elles on fait à leur fantaisie. Le	père	Goriot était sublime. Jamais Eugène ne l’avait pu voir illuminé
TXM_etude_des_moeurs	madame Delphine. — Bah ! dit le	père	Goriot. — Oui. Je ne lui ai pas déplu.
TXM_etude_des_moeurs	Grand Turc. Depuis cette conversation, le	père	Goriot vit dans son voisin un confident inespéré, un ami.
TXM_etude_des_moeurs	ne font jamais de faux calculs. Le	père	Goriot se voyait un peu plus près de sa fille Delphine,
TXM_etude_des_moeurs	au déjeuner, l’affectation avec laquelle le	père	Goriot regardait Eugène, près duquel il se plaça, les quelques
TXM_etude_des_moeurs	d’avoir une loge aux Italiens. Le	père	Goriot saisit cette parole au vol comme un chien saisit un mouvement
TXM_etude_des_moeurs	, où je succéderai tout bêtement à mon	père	. Les affections de l’homme se satisfont dans le plus petit
TXM_etude_des_moeurs	Eugène revint la pension, il trouva le	père	Goriot qui l’attendait. — Tenez, dit le bonhomme,
TXM_etude_des_moeurs	lettre et lut. « Monsieur, mon	père	m’a dit que, vous aimiez la musique italienne. Je
TXM_etude_des_moeurs	. — Eh ! bien, dit le	père	Goriot, à quoi pensez -vous donc ? Eugène ne connaissait pas
TXM_etude_des_moeurs	économies et celui que me donnait mon pauvre	père	; puis je me suis endettée. Le mariage pour moi est
TXM_etude_des_moeurs	des bijoux, des fantaisies (mon pauvre	père	nous avait accoutumées à ne nous rien refuser), j’ai
TXM_etude_des_moeurs	ma femme de chambre. Aller trouver mon	père	, folie ! Anastasie et moi nous l’avons égorgé : mon
TXM_etude_des_moeurs	moi nous l’avons égorgé : mon pauvre	père	se serait vendu s’il pouvait valoir six mille francs. J’
TXM_etude_des_moeurs	il y vit de la lumière. Le	père	Goriot avait laissé sa porte ouverte et sa chandelle allumée, afin
TXM_etude_des_moeurs	rien, — Mais, s’écria le	père	Goriot dans un violent désespoir de jalousie, elles me croient ruiné
TXM_etude_des_moeurs	Oh ! donnez -le -moi, dit le	père	Goriot. Comment ! il y a eu là des larmes de
TXM_etude_des_moeurs	vais retrouver mes dents. — Tenez,	père	, voici mille francs qu’elle a voulu me donner sur notre
TXM_etude_des_moeurs	pouvez dormir, vous n’êtes pas encore	père	. Elle a pleuré, j’apprends ça, moi, qui
TXM_etude_des_moeurs	en déjeunant, il raconta ses succès au	père	Goriot devant les pensionnaires, Vautrin se prit à sourire d’une
TXM_etude_des_moeurs	le monde dans une pensée ? Voyez le	père	Goriot : ses deux filles sont pour lui tout l’univers,
TXM_etude_des_moeurs	l’amour et de la fortune de son	père	, pendant qu’elle sera là tranquillement à tremper ses mouillettes de
TXM_etude_des_moeurs	pouvait rien répondre. En ce moment le	père	Goriot, Bianchon et quelques autres pensionnaires arrivèrent. — Voilà comme
TXM_etude_des_moeurs	d’aller prévenir pendant la soirée messieurs Taillefer	père	et fils. En ce moment, Vautrin l’ayant quitté,
TXM_etude_des_moeurs	moment, Vautrin l’ayant quitté, le	père	Goriot lui dit à l’oreille : — Vous êtes triste,
TXM_etude_des_moeurs	dans sa pauvre chambre en désordre. Le	père	Goriot saisit un moment où l’étudiant lui tournait le dos,
TXM_etude_des_moeurs	» Quand elles me disent cérémonieusement : Mon	père	, elles me glacent ; mais quand elles m’appellent papa,
TXM_etude_des_moeurs	tous mes souvenirs. Je suis mieux leur	père	, Je crois qu’elles ne sont encore à personne ! Le
TXM_etude_des_moeurs	: « N’est -ce pas, mon	père	, il est bien ! il a bon cœur ! Parle-t -il
TXM_etude_des_moeurs	là sur votre cheminée ? dit enfin le	père	Goriot qui se mourait d’impatience en voyant Rastignac immobile. Eugène
TXM_etude_des_moeurs	dessins répondaient à tous ses vœux. Le	père	Goriot était radieux. Il avait sans doute promis à sa fille
TXM_etude_des_moeurs	-ce pas ? — Oui, mon bon	père	Goriot, vous savez bien que je vous aime. — Je
TXM_etude_des_moeurs	Nucingen, allez chez M. Taillefer le	père	, lui dire de me donner une heure dans la soirée pour
TXM_etude_des_moeurs	-ce donc vrai, jeune homme dit le	père	Goriot en changeant de visage ; feriez -vous la cour à sa
TXM_etude_des_moeurs	— Ah ! quel bonheur ! fit le	père	Goriot. — Mais, reprit l’étudiant, le fils de
TXM_etude_des_moeurs	-vous jolie, la montre ? dit le	père	Goriot. Elle a bon goût, hein ! Vautrin, le
TXM_etude_des_moeurs	bon goût, hein ! Vautrin, le	père	Goriot et Rastignac descendirent ensemble et se trouvèrent par suite de leur
TXM_etude_des_moeurs	discours badins ; mais respectez l’innocence du	père	Goriot. Je vous propose une petite bouteillorama de vin de Bordeaux
TXM_etude_des_moeurs	rempli le verre d’Eugène et celui du	père	Goriot, il s’en versa lentement quelques gouttes qu’il dégusta
TXM_etude_des_moeurs	d’orchestre, en surveillant Eugène et le	père	Goriot, qui semblaient ivres déjà. Le dos appuyé sur leur
TXM_etude_des_moeurs	. Ah ! nous voulions aller prévenir le	père	Taillefer, commettre des fautes d’écolier ! Le four est chaud
TXM_etude_des_moeurs	Couture, mademoiselle Victorine, Vautrin et le	père	Goriot, Rastignac aperçut, comme s’il eût rêvé, madame
TXM_etude_des_moeurs	remuant d’une manière comique la tête du	père	Goriot et celle d’Eugène. En plaçant la tête de l’
TXM_etude_des_moeurs	se tournant vers le vermicellier, voilà le	père	Goriot parti. Ce vieux cancre -là n’a jamais eu l’
TXM_etude_des_moeurs	de bonheur celui qui vous aime. Votre	père	vous appelle auprès de lui. Vous vous mariez avec un homme
TXM_etude_des_moeurs	Vautrin avait fait boire à Eugène et au	père	Goriot du vin narcotisé décida la perte de cet homme. Bianchon
TXM_etude_des_moeurs	, après ce que vous a dit mon	père	. Je me fâcherai, mais je vous pardonnerai. Êtes -vous
TXM_etude_des_moeurs	Mais si vous étiez mal portant, mon	père	serait venu me le dire ! Qu’est -il donc arrivé ?
TXM_etude_des_moeurs	Mademoiselle, s’écria-t -il, monsieur votre	père	vous demande. Un grand malheur est arrivé. Monsieur Frédéric s’
TXM_etude_des_moeurs	longtemps ! Quel quine pour Victorine ! Son	père	est forcé de l’adopter. — Voila ! dit Vautrin en
TXM_etude_des_moeurs	bon endroit. À cette interpellation, le	père	Goriot regarda l’étudiant et lui vit à la main la lettre
TXM_etude_des_moeurs	de dégoût qui surprit les assistants. Le	père	Goriot saisit la main de l’étudiant et la lui serra.
TXM_etude_des_moeurs	apoplexie. Christophe sortit. — Mais,	père	Goriot, aidez -nous donc à le transporter là-haut, chez lui
TXM_etude_des_moeurs	. Il se souvint des confidences que le	père	Goriot lui avait faites la veille, il se rappela l’appartement
TXM_etude_des_moeurs	j’aurai soin de lui comme d’un	père	, je lui donnerai mille jouissances. Si elle m’aime,
TXM_etude_des_moeurs	infâme, elle ferait un portier de son	père	. Chère Delphine ! elle est meilleure pour le bonhomme, elle
TXM_etude_des_moeurs	de Victorine, étaient réunis, moins le	père	Goriot, et devisaient de cette aventure. Quand Eugène entra,
TXM_etude_des_moeurs	ce gredin de Fil-de-Soie. Pas vrai,	père	l’empoigneur ? dit -il au chef de police. Ça s’
TXM_etude_des_moeurs	leurs effets, et vont demeurer chez son	père	. Monsieur Taillefer permet à sa fille de garder la veuve Couture
TXM_etude_des_moeurs	-ce que ça nous fait ? répondit le	père	Goriot. Je dîne avec ma fille, chez vous, entendez
TXM_etude_des_moeurs	se trouva dans le fiacre à côté du	père	Goriot dont les discours trahissaient une joie inaccoutumée, et retentissaient à
TXM_etude_des_moeurs	donc renversé ? — Renversé ? dit le	père	Goriot. Mais à aucune époque le monde n’a si bien
TXM_etude_des_moeurs	Mais marchez donc, cocher, cria le	père	Goriot en ouvrant la glace de devant. Allez donc plus vite
TXM_etude_des_moeurs	va pas, ce cocher, disait le	père	Goriot. — Mais où me conduisez -vous donc, lui demanda
TXM_etude_des_moeurs	Rastignac. – Chez vous, dit le	père	Goriot. La voiture s’arrêta rue d’Artois. Le bonhomme
TXM_etude_des_moeurs	maison neuve et de belle apparence. Le	père	Goriot n’eut pas besoin de sonner. Thérèse, la femme
TXM_etude_des_moeurs	il t’aimait, dit tout bas le	père	Goriot à sa fille pendant qu’Eugène abattu gisait sur la causeuse
TXM_etude_des_moeurs	serai pas quelqu’un, moi, dit le	père	Goriot en grognant. — Vous savez bien que vous êtes nous
TXM_etude_des_moeurs	c’est ce qui fait qu’on est	père	. — Comment ? dit Eugène. — Oui, elle ne
TXM_etude_des_moeurs	de faire ce qu’elle fait … Le	père	Goriot parlait tout seul, madame de Nucingen avait emmené Rastignac dans
TXM_etude_des_moeurs	un mot. Parlez ? Mais, mon	père	, dites -lui donc quelques bonnes raisons, ajouta-t -elle en se
TXM_etude_des_moeurs	, ajouta-t -elle en se tournant vers son	père	après une pause. Croit -il que je ne sois pas moins
TXM_etude_des_moeurs	chatouilleuse que lui sur notre honneur ? Le	père	Goriot avait le sourire fixe d’un thériaki en voyant, en
TXM_etude_des_moeurs	— Je vais vous décider, dit le	père	Goriot en sortant de son extase. Mon cher monsieur Eugène,
TXM_etude_des_moeurs	dit Goriot. — Mais, mon pauvre	père	, dit madame de Nucingen, comment avez -vous donc fait ?
TXM_etude_des_moeurs	dit madame de Nucingen en sautant sur son	père	qui la reçut sur ses genoux. Elle le couvrit de baisers
TXM_etude_des_moeurs	vieux visage épanoui, brillant. — Cher	père	, vous êtes un père ! Non, il n’existe pas
TXM_etude_des_moeurs	. — Cher père, vous êtes un	père	! Non, il n’existe pas deux pères comme vous sous
TXM_etude_des_moeurs	— Mais, mes enfants, dit le	père	Goriot qui depuis dix ans n’avait pas senti le cœur de
TXM_etude_des_moeurs	mondes par le Sauveur des hommes. Le	père	Goriot baisa bien doucement la ceinture que ses doigts avaient trop pressée
TXM_etude_des_moeurs	mademoiselle Taillefer et ses millions, dit le	père	Goriot. Oui, elle vous aimait, la petite ; et
TXM_etude_des_moeurs	eue depuis vos mariages, s’écria le	père	Goriot. Le bon Dieu peut me faire souffrir tant qu’il
TXM_etude_des_moeurs	tout est à nous. — Ce pauvre	père	! — Si tu savais, mon enfant, dit -il en
TXM_etude_des_moeurs	-moi, dis ! — Oui, cher	père	. — Dis encore. — Oui, mon bon père.
TXM_etude_des_moeurs	Dis encore. — Oui, mon bon	père	. — Tais -toi, je te le ferais dire cent fois
TXM_etude_des_moeurs	entière fut employée en enfantillages, et le	père	Goriot ne se montra pas le moins fou des trois. Il
TXM_etude_des_moeurs	! dit Delphine à Eugène, quand mon	père	est avec nous, il faut être tout à lui. Ce
TXM_etude_des_moeurs	irai au parterre, moi, dit le	père	Goriot. Il était minuit. La voiture de madame de Nucingen
TXM_etude_des_moeurs	voiture de madame de Nucingen attendait. Le	père	Goriot et l’étudiant retournèrent à la Maison-Vauquer en s’entretenant de
TXM_etude_des_moeurs	pouvait pas se dissimuler que l’amour du	père	, qu’aucun intérêt personnel n’entachait, écrasait le sien par
TXM_etude_des_moeurs	idole était toujours pure et belle pour le	père	, et son adoration s’accroissait de tout le passé comme de
TXM_etude_des_moeurs	homme … En ce moment Eugène et le	père	Goriot sonnèrent. — Ah ! voilà mes deux fidèles, dit
TXM_etude_des_moeurs	bon déménager, dit tout bas Eugène au	père	Goriot. — Madame, dit Sylvie en accourant effarée, voici
TXM_etude_des_moeurs	. — Eh bien ? lui dit le	père	Goriot quand Rastignac passa devant sa porte. — Eh ! bien
TXM_etude_des_moeurs	descendit de sa voiture, demanda si son	père	était encore à la pension. Sur la réponse affirmative de Sylvie
TXM_etude_des_moeurs	Il avait, en déjeunant, prié le	père	Goriot d’emporter ses effets, en lui disant qu’ils se
TXM_etude_des_moeurs	mots, il trouva la conversation entre le	père	et la fille trop intéressante pour ne pas l’écouter. —
TXM_etude_des_moeurs	pas l’écouter. — Ah ! mon	père	, dit -elle, plaise au ciel que vous ayez eu l’
TXM_etude_des_moeurs	, la maison est vide, dit le	père	Goriot d’une voix altérée. — Qu’avez -vous donc,
TXM_etude_des_moeurs	. — Qu’avez -vous donc, mon	père	? reprit madame de Nucingen. — Tu viens, répondit le
TXM_etude_des_moeurs	rue d’Artois ? — Eh ! mon	père	, est -on maître de son premier mouvement dans une catastrophe ?
TXM_etude_des_moeurs	de dire ? — Bien, répondit le	père	Goriot. — Eh ! bien, reprit Delphine, il m’
TXM_etude_des_moeurs	maîtresse de tous les biens. Mon chère	père	, il était sincère, il m’a effrayée. Il m’
TXM_etude_des_moeurs	crois à ces sornettes, s’écria le	père	Goriot. C’est un comédien ! J’ai rencontré des Allemands
TXM_etude_des_moeurs	verrai de mes yeux. — Mon cher	père	! allez -y prudemment. Si vous mettiez la moindre velléité de
TXM_etude_des_moeurs	— Eh ! bien, oui, mon	père	, dit -elle en se jetant sur une chaise en pleurant.
